{
  "schema": "specnav.verification.case-approval.v1",
  "id": "approval-verification-2-0-20260806",
  "change_id": "verification-2-0",
  "snapshot_id": "snapshot-5be49e798f6b94dcb4822a60",
  "snapshot_hash": "5be49e798f6b94dcb4822a608397cf097a336cc73a319dd69aca25549bc48f5a",
  "decision": "approved",
  "reviewer": {
    "id": "wenliang_zeng",
    "kind": "human",
    "display_name": "Wenliang Zeng"
  },
  "decided_at": "2026-08-06T06:31:16Z",
  "comment": "Approved by the user in the active Codex task for complete Verification 2.0 six-domain execution."
}
